{
  "$schema": "https://json-schema.org/draft/2020-12/schema",
  "$id": "skyguard/injection_label",
  "title": "Injection label (one injected fault; lives in a separate file, never in the stream)",
  "type": "object",
  "required": [
    "schema_v",
    "injection_id",
    "station_id",
    "variable",
    "root_cause",
    "start_ts",
    "end_ts",
    "params",
    "difficulty",
    "seed",
    "split"
  ],
  "properties": {
    "schema_v": {
      "const": "1.0"
    },
    "injection_id": {
      "type": "string",
      "minLength": 1
    },
    "station_id": {
      "type": "string",
      "minLength": 1
    },
    "variable": {
      "enum": [
        "T",
        "Td",
        "RH",
        "P",
        "all"
      ]
    },
    "root_cause": {
      "enum": [
        "spike",
        "frozen",
        "drift",
        "offset",
        "noise",
        "out_of_range",
        "radiation",
        "power",
        "comms_gap",
        "duplicate",
        "timeshift",
        "unknown"
      ]
    },
    "start_ts": {
      "type": "string",
      "pattern": "^\\d{4}-\\d{2}-\\d{2}T\\d{2}:\\d{2}:\\d{2}Z$"
    },
    "end_ts": {
      "type": "string",
      "pattern": "^\\d{4}-\\d{2}-\\d{2}T\\d{2}:\\d{2}:\\d{2}Z$"
    },
    "params": {
      "type": "object"
    },
    "difficulty": {
      "enum": [
        "easy",
        "medium",
        "hard"
      ]
    },
    "seed": {
      "type": "integer"
    },
    "split": {
      "enum": [
        "train",
        "val",
        "val_cal",
        "val_eval",
        "test"
      ]
    }
  },
  "additionalProperties": false
}
