{
  "schema_v": "1.0",
  "injection_id": "inj_0001",
  "station_id": "INI0000VIDD",
  "variable": "T",
  "root_cause": "drift",
  "start_ts": "2024-05-10T00:00:00Z",
  "end_ts": "2024-06-02T00:00:00Z",
  "params": {
    "rate_per_day": 0.03
  },
  "difficulty": "hard",
  "seed": 42,
  "split": "test"
}
